Link,Titolo,Categoria,Data_pubblicazione,Timestamp dello scraping
https://nova.ilsole24ore.com/infodata/vegani-a-destra-vegetariani-a-sinistra-ma-chi-lo-fa-per-lambiente/,"Vegani a destra, vegetariani a sinistra. Ma chi lo fa per l'ambiente?",CREATIVITÀ,08/10/2019,"09/10/2020, 12:04:46"
https://nova.ilsole24ore.com/infodata/mele-e-pomodori-litalia-e-campione-deuropa-agli-olandesi-vanno-le-cipolle-2/,"Mele e pomodori, l'Italia è campione d'Europa. Agli olandesi vanno le cipolle",CREATIVITÀ,07/10/2019,"09/10/2020, 12:04:46"
https://nova.ilsole24ore.com/infodata/mele-e-pomodori-litalia-e-campione-deuropa-agli-olandesi-vanno-le-cipolle/,"Mele e pomodori, l'Italia è campione d'Europa. Agli olandesi vanno le cipolle",CREATIVITÀ,07/10/2019,"09/10/2020, 12:04:47"
https://nova.ilsole24ore.com/infodata/stranger-things-4-i-tutti-i-numeri-della-serie-cult/,"Stranger Things 4, i tutti i numeri della serie cult",CREATIVITÀ,06/10/2019,"09/10/2020, 12:04:47"
https://nova.ilsole24ore.com/infodata/i-nonni-il-loro-stipendio-ipotetico-e-le-loro-reali-condizioni-di-salute-2/,"I nonni, il loro stipendio (ipotetico) e le loro (reali) condizioni di salute",CREATIVITÀ,06/10/2019,"09/10/2020, 12:04:47"
https://nova.ilsole24ore.com/infodata/i-tempi-di-pagamento-delle-pa-i-soliti-ritardi-e-una-buona-notizia/,I tempi di pagamento delle Pa: i soliti ritardi e una buona notizia,CREATIVITÀ,06/10/2019,"09/10/2020, 12:04:48"
https://nova.ilsole24ore.com/infodata/dazi-usa-chi-rischia-di-piu-tra-gli-stati-dellunione-europea-il-perimetro-delle-ritorsioni/,"Dazi Usa, chi rischia di più tra gli Stati dell'Unione europea? Il perimetro delle ritorsioni",CREATIVITÀ,04/10/2019,"09/10/2020, 12:04:48"
https://nova.ilsole24ore.com/infodata/ce-un-cinese-uno-svedese-e-un-americano-scopri-di-chi-e-la-colpa-del-riscaldamento-globale/,"C'è un cinese, uno svedese e un americano. Scopri di chi è la colpa del riscaldamento globale?",CREATIVITÀ,04/10/2019,"09/10/2020, 12:04:48"
https://nova.ilsole24ore.com/infodata/i-tempi-di-pagamento-delle-pa-le-regioni-piu-virtuose-i-ritardi-e-una-buona-notizia/,"I tempi di pagamento delle Pa: le regioni più virtuose, i ritardi e una buona notizia",CREATIVITÀ,03/10/2019,"09/10/2020, 12:04:49"
https://nova.ilsole24ore.com/infodata/quanti-bimbi-alla-scuola-dellinfanzia-in-campania-vanno-tutti-100-alla-materna-un-record-in-europa/,"Quanti bimbi alla scuola dell'infanzia? In Campania vanno tutti (100%) alla materna, un record in Europa",CREATIVITÀ,03/10/2019,"09/10/2020, 12:04:49"
https://nova.ilsole24ore.com/infodata/quanti-bimbi-alla-scuola-dellinfanzia-in-campania-vanno-tutti-100-alla-materna-un-record-in-europa-2/,"Quanti bimbi alla scuola dell'infanzia? In Campania vanno tutti (100%) alla materna, un record in Europa",CREATIVITÀ,03/10/2019,"09/10/2020, 12:04:49"
https://nova.ilsole24ore.com/infodata/i-nonni-il-loro-stipendio-ipotetico-e-le-loro-reali-condizioni-di-salute/,"I nonni, il loro stipendio (ipotetico) e le loro (reali) condizioni di salute",CREATIVITÀ,02/10/2019,"09/10/2020, 12:04:50"
https://nova.ilsole24ore.com/infodata/cannabis-e-cocaina-i-sequestri-lo-spaccio-e-il-nodo-delle-frontiere-marittime/,"Cannabis e cocaina: i sequestri, lo spaccio e il nodo delle frontiere marittime",CREATIVITÀ,02/10/2019,"09/10/2020, 12:04:50"
https://nova.ilsole24ore.com/infodata/cambiamenti-climatici-e-salute-globale-cosa-dicono-i-dati-e-la-letteratura-scientifica/,Cambiamenti climatici e salute globale: cosa dicono i dati e la letteratura scientifica,CREATIVITÀ,01/10/2019,"09/10/2020, 12:04:50"
https://nova.ilsole24ore.com/infodata/stranger-things-4-il-nuovo-teaser-e-i-tutti-i-numeri-della-serie-cult/,"Stranger Things 4, il nuovo teaser e i tutti i numeri della serie cult",CREATIVITÀ,01/10/2019,"09/10/2020, 12:04:51"
https://nova.ilsole24ore.com/infodata/droga-tornano-a-crescere-gli-stupefacenti-sequestrati-liguria-e-lazio-in-cima-alla-classifica/,"Droga, tornano a crescere gli stupefacenti sequestrati. Liguria e Lazio in cima alla classifica",CREATIVITÀ,30/09/2019,"09/10/2020, 12:04:51"
https://nova.ilsole24ore.com/infodata/dove-vivono-gli-ultra-ricchi-e-quanto-contribuiscono-al-benessere-del-loro-paese/,Dove vivono gli ultra-ricchi e quanto contribuiscono al benessere del loro Paese?,CREATIVITÀ,30/09/2019,"09/10/2020, 12:04:51"
https://nova.ilsole24ore.com/infodata/volete-salvare-il-pianeta-dal-riscaldamento-globale-i-gesti-quotidiani-che-non-servono/,Volete salvare il Pianeta dal riscaldamento globale? I gesti quotidiani (che non servono),CREATIVITÀ,29/09/2019,"09/10/2020, 12:04:52"
https://nova.ilsole24ore.com/infodata/volete-davvero-salvare-il-pianeta-dal-riscaldamento-globale-i-piccoli-gesti-quotidiani-che-non-servono/,Volete davvero salvare il Pianeta dal riscaldamento globale? I piccoli gesti quotidiani (che non servono),CREATIVITÀ,27/09/2019,"09/10/2020, 12:04:52"
https://nova.ilsole24ore.com/infodata/tutti-gli-astronauti-che-hanno-messo-piede-sulliss-ce-molta-italia-nello-spazio/,Tutti gli astronauti che hanno messo piede sull'Iss. C'è molta Italia nello Spazio.,CREATIVITÀ,27/09/2019,"09/10/2020, 12:04:52"
https://nova.ilsole24ore.com/infodata/tutti-gli-astronauti-che-hanno-messo-piede-sulliss-ce-molta-italia-nello-spazio-2/,Tutti gli astronauti che hanno messo piede sull'Iss. C'è molta Italia nello Spazio.,CREATIVITÀ,27/09/2019,"09/10/2020, 12:04:53"
https://nova.ilsole24ore.com/infodata/il-riscaldamento-climatico-si-combatte-meglio-con-il-portafoglio-pieno/,Il riscaldamento climatico si combatte meglio con il portafoglio pieno,CREATIVITÀ,27/09/2019,"09/10/2020, 12:04:53"
https://nova.ilsole24ore.com/infodata/in-italia-calano-gli-studenti-e-ancora-di-piu-la-spesa-il-nodo-della-scuola-pubblica/,"In Italia calano gli studenti, e ancora di più la spesa. Il nodo della scuola pubblica",CREATIVITÀ,26/09/2019,"09/10/2020, 12:04:53"
https://nova.ilsole24ore.com/infodata/offerte-di-lavoro-lhi-tech-e-anticiclico-non-sente-il-rallentamento-delleconomia/,"Offerte di lavoro, l'hi-tech è anticiclico, non sente il rallentamento dell'economia",CREATIVITÀ,26/09/2019,"09/10/2020, 12:04:54"
https://nova.ilsole24ore.com/infodata/il-climate-change-si-combatte-meglio-con-il-portafoglio-pieno/,Il climate change si combatte meglio con il portafoglio pieno,CREATIVITÀ,29/09/2019,"09/10/2020, 12:04:54"
https://nova.ilsole24ore.com/infodata/a-new-york-airbnb-ha-occupato-manhattan-la-mappa-e-le-curiosita/,A New York Airbnb ha occupato Manhattan. La mappa e le curiosità,CREATIVITÀ,29/09/2019,"09/10/2020, 12:04:55"
https://nova.ilsole24ore.com/infodata/scopri-gli-animali-piu-pericolosi-per-luomo-sopresa-non-e-lo-squale-e-neppure-il-lupo/,"Scopri gli animali più pericolosi per l'uomo. Sopresa, non è lo squale e neppure il lupo ",CREATIVITÀ,28/09/2019,"09/10/2020, 12:04:55"
https://nova.ilsole24ore.com/infodata/le-donne-lavorano-in-part-time-per-occuparsi-della-famiglia-in-italia-e-anche-in-europa/,Le donne lavorano in part-time per occuparsi della famiglia. In Italia e anche in Europa,CREATIVITÀ,28/09/2019,"09/10/2020, 12:04:55"
https://nova.ilsole24ore.com/infodata/gli-aerei-sono-il-mezzo-di-trasporto-piu-inquinante-tutti-i-numeri/,Gli aerei sono il mezzo di trasporto più inquinante. Tutti i numeri,CREATIVITÀ,28/09/2019,"09/10/2020, 12:04:55"
https://nova.ilsole24ore.com/infodata/farmaci-statine-e-antipertensivi-cresce-il-consumo-ma-pochi-seguono-bene-la-terapia/,"Farmaci, statine e antipertensivi: cresce il consumo ma pochi seguono bene la terapia",CREATIVITÀ,28/09/2019,"09/10/2020, 12:04:56"
https://nova.ilsole24ore.com/infodata/a-new-york-airbnb-ha-occupato-manatthan-la-mappa-le-proteste-e-le-curiosita/,"A New York Airbnb ha occupato Manatthan. La mappa, le proteste e le curiosità",CREATIVITÀ,25/09/2019,"09/10/2020, 12:04:56"
https://nova.ilsole24ore.com/infodata/chi-sono-i-premier-a-piu-alto-tasso-di-anidride-carbonica-non-ditelo-a-greta-thunberg/,Chi sono i premier a più alto tasso di anidride carbonica? Non ditelo a Greta Thunberg,CREATIVITÀ,24/09/2019,"09/10/2020, 12:04:56"
https://nova.ilsole24ore.com/infodata/scopri-gli-animali-piu-pericolosi-per-luomo-e-no-non-e-lo-squalo/,"Scopri gli animali più pericolosi per l'uomo. E no, non è lo squalo",CREATIVITÀ,24/09/2019,"09/10/2020, 12:04:57"
https://nova.ilsole24ore.com/infodata/le-donne-lavorano-in-part-time-per-occuparsi-della-famiglia-in-europa-e-in-italia/,Le donne lavorano in part-time per occuparsi della famiglia. In Europa e in Italia.,CREATIVITÀ,24/09/2019,"09/10/2020, 12:04:57"
https://nova.ilsole24ore.com/infodata/quanto-inquinano-gli-aerei-il-settore-produce-il-2-circa-delle-emissioni-di-co2/,Quanto inquinano gli aerei? Il settore produce il 2% circa delle emissioni di CO2,CREATIVITÀ,23/09/2019,"09/10/2020, 12:04:57"
https://nova.ilsole24ore.com/infodata/farmaci-cresce-il-consumo-di-statine-e-antipertensivi-ma-pochi-seguono-bene-la-terapia/,"Farmaci, cresce il consumo di statine e antipertensivi ma pochi seguono bene la terapia",CREATIVITÀ,23/09/2019,"09/10/2020, 12:04:58"
https://nova.ilsole24ore.com/infodata/europa-gli-stipendi-crescono-tranne-che-in-grecia-e-in-molise-2/,"Europa, gli stipendi crescono. Tranne che in Grecia (e in Molise)",CREATIVITÀ,22/09/2019,"09/10/2020, 12:04:58"
https://nova.ilsole24ore.com/infodata/litalia-ha-il-corpo-docente-piu-anziano-deuropa/,L'Italia ha il corpo docente più anziano d'Europa,CREATIVITÀ,22/09/2019,"09/10/2020, 12:04:58"
https://nova.ilsole24ore.com/infodata/il-ritorno-delle-foreste-in-italia-leuropa-e-un-continente-piu-verde/,Il ritorno delle foreste in Italia. L'Europa è un continente più verde,CREATIVITÀ,22/09/2019,"09/10/2020, 12:04:59"
https://nova.ilsole24ore.com/infodata/calano-le-adozioni-di-cani-il-randagismo-e-una-emergenza/,"Calano le adozioni di cani, il randagismo è una emergenza",CREATIVITÀ,22/09/2019,"09/10/2020, 12:04:59"
https://nova.ilsole24ore.com/infodata/le-scissioni-della-sinistra-al-microscopio-chi-e-uscito-quanti-voti-ha-preso-e-il-futuro/,"Le scissioni della sinistra al microscopio: chi è uscito, quanti voti ha preso e il futuro",CREATIVITÀ,21/09/2019,"09/10/2020, 12:04:59"
https://nova.ilsole24ore.com/infodata/spesa-sanitaria-perche-continuano-a-crescere-i-consumi-di-farmaci-a-brevetto-scaduto/,"Spesa sanitaria, perché continuano a crescere i consumi di farmaci a brevetto scaduto?",CREATIVITÀ,21/09/2019,"09/10/2020, 12:05:00"
https://nova.ilsole24ore.com/infodata/le-ore-di-insegnamento-dei-docenti-italiani-sono-al-di-sotto-della-media-europea/,Le ore di insegnamento dei docenti italiani sono al di sotto della media europea,CREATIVITÀ,17/09/2019,"09/10/2020, 12:05:00"
https://nova.ilsole24ore.com/infodata/renzi-lascia-il-pd-la-sinistra-le-scissioni-e-la-fisica-delle-particelle/,"Renzi lascia il Pd. La sinistra, le scissioni e la fisica delle particelle",CREATIVITÀ,17/09/2019,"09/10/2020, 12:05:00"
https://nova.ilsole24ore.com/infodata/gli-smartphone-e-i-social-stanno-cambiando-le-interazioni-sociali-nelle-economie-emergenti/,Gli smartphone e i social stanno cambiando le interazioni sociali nelle economie emergenti?,CREATIVITÀ,17/09/2019,"09/10/2020, 12:05:01"
https://nova.ilsole24ore.com/infodata/scuola-reddito-e-tenore-di-vita-ecco-come-vivono-e-quanto-guadagnano-gli-insegnanti-italiani/,"Scuola, reddito e tenore di vita. Ecco come vivono e quanto guadagnano gli insegnanti italiani",CREATIVITÀ,16/09/2019,"09/10/2020, 12:05:01"
https://nova.ilsole24ore.com/infodata/buone-notizie-per-la-spesa-sanitaria-continuano-a-crescere-i-consumi-di-farmaci-a-brevetto-scaduto/,"Buone notizie per la spesa sanitaria, continuano a crescere i consumi di farmaci a brevetto scaduto",CREATIVITÀ,16/09/2019,"09/10/2020, 12:05:01"
https://nova.ilsole24ore.com/infodata/ogni-venti-secondi-si-vende-una-bicicletta-i-numeri-dellitalia-a-due-ruote/,Ogni venti secondi si vende una bicicletta. I numeri dell'Italia a due ruote,CREATIVITÀ,15/09/2019,"09/10/2020, 12:05:02"
https://nova.ilsole24ore.com/infodata/scuola-reddito-e-tenore-di-vita-ecco-quanto-guadagnano-gli-insegnanti-italiani/,"Scuola, reddito e tenore di vita. Ecco quanto guadagnano gli insegnanti italiani",CREATIVITÀ,21/09/2019,"09/10/2020, 12:05:02"
https://nova.ilsole24ore.com/infodata/sciopero-contro-il-riscaldamento-climatico-misura-leffetto-del-climate-change-sullitalia/,Sciopero contro il riscaldamento climatico? Misura l'effetto del climate change sull'Italia,CREATIVITÀ,20/09/2019,"09/10/2020, 12:05:02"
https://nova.ilsole24ore.com/infodata/il-ritorno-delle-foreste-in-italia-leuropa-e-un-continente-piu-verde-di-un-secolo-fa/,Il ritorno delle foreste in Italia. L'Europa è un continente più verde di un secolo fa,CREATIVITÀ,20/09/2019,"09/10/2020, 12:05:03"
https://nova.ilsole24ore.com/infodata/litalia-ha-il-corpo-docente-pia-anziano-deuropa-e-non-solo/,L'Italia ha il corpo docente pià anziano d'Europa (e non solo),CREATIVITÀ,19/09/2019,"09/10/2020, 12:05:03"
https://nova.ilsole24ore.com/infodata/calano-le-adozioni-di-cani-il-randagismo-e-una-emergenza-specie-al-sud/,"Calano le adozioni di cani, il randagismo è una emergenza, specie al sud",CREATIVITÀ,19/09/2019,"09/10/2020, 12:05:03"
https://nova.ilsole24ore.com/infodata/europa-gli-stipendi-crescono-tranne-che-in-grecia-e-in-molise/,"Europa, gli stipendi crescono. Tranne che in Grecia e in Molise",CREATIVITÀ,18/09/2019,"09/10/2020, 12:05:04"
https://nova.ilsole24ore.com/infodata/salute-mentale-antidepressivi-in-tanti-li-usano-in-pochi-lo-fanno-bene/,"Salute mentale, antidepressivi: in tanti li usano, in pochi lo fanno bene",CREATIVITÀ,15/09/2019,"09/10/2020, 12:05:04"
https://nova.ilsole24ore.com/infodata/scuola-in-quanti-anni-di-lavoro-si-ripaga-una-laurea-dipende-dal-luogo-in-cui-vivi/,"Scuola, in quanti anni di lavoro si ripaga una laurea? Dipende dal luogo in cui vivi",CREATIVITÀ,15/09/2019,"09/10/2020, 12:05:04"
https://nova.ilsole24ore.com/infodata/chi-prende-il-reddito-di-cittadinanza-poche-persone-e-al-sud-la-mappa-comunale/,Chi prende il reddito di cittadinanza? Poche persone e al Sud. La mappa comunale,CREATIVITÀ,15/09/2019,"09/10/2020, 12:05:05"
https://nova.ilsole24ore.com/infodata/quanto-tempo-ci-vuole-per-diventare-milionari/,Quanto tempo ci vuole per diventare milionari?,CREATIVITÀ,14/09/2019,"09/10/2020, 12:05:05"
https://nova.ilsole24ore.com/infodata/unimpresa-su-cinque-e-ambulante-e-non-sono-solo-stranieri/,Un'impresa su cinque è ambulante. E non sono solo stranieri,CREATIVITÀ,14/09/2019,"09/10/2020, 12:05:05"
https://nova.ilsole24ore.com/infodata/quante-probabilita-ha-il-governo-conte-bis-di-chiudere-la-legislatura-se-si-considerano-le-serie-storiche/,Quante probabilità ha il Governo Conte bis di chiudere la legislatura? Se si considerano le serie storiche,CREATIVITÀ,14/09/2019,"09/10/2020, 12:05:05"
https://nova.ilsole24ore.com/infodata/scopri-come-e-cambiato-con-giuseppe-conte-il-volto-della-repubblica-italiana/,Scopri come è cambiato con Giuseppe Conte il volto della Repubblica italiana,CREATIVITÀ,14/09/2019,"09/10/2020, 12:05:06"
https://nova.ilsole24ore.com/infodata/scuola-in-quanti-anni-di-lavoro-si-ripaga-una-laurea-dipende-dove-vivi/,"Scuola, in quanti anni di lavoro si ripaga una laurea? Dipende dove vivi",CREATIVITÀ,13/09/2019,"09/10/2020, 12:05:06"
https://nova.ilsole24ore.com/infodata/dallisola-kaffeklubben-al-monte-thor-i-luoghi-piu-curiosi-della-terra/,Dall'isola Kaffeklubben al monte Thor. I luoghi più curiosi della Terra,CREATIVITÀ,13/09/2019,"09/10/2020, 12:05:06"
https://nova.ilsole24ore.com/infodata/chi-prende-il-reddito-di-cittadinanza-poche-persone-e-soprattutto-al-sud-la-mappa-provinciale/,Chi prende il reddito di cittadinanza? Poche persone e soprattutto al Sud. La mappa provinciale,CREATIVITÀ,12/09/2019,"09/10/2020, 12:05:07"
https://nova.ilsole24ore.com/infodata/come-sta-la-ricerca-in-italia-male-ma-non-malissimo-ecco-quanto-e-dove-abbiamo-speso-per-linnovazione/,Come sta la ricerca in Italia? Male ma non malissimo. Ecco quanto e dove abbiamo speso per l'innovazione,CREATIVITÀ,12/09/2019,"09/10/2020, 12:05:07"
https://nova.ilsole24ore.com/infodata/ogni-venti-secondi-si-vende-una-bicicletta-i-numeri-dellanomalia-italiana/,Ogni venti secondi si vende una bicicletta. I numeri dell'anomalia italiana,CREATIVITÀ,11/09/2019,"09/10/2020, 12:05:07"
https://nova.ilsole24ore.com/infodata/quanti-anni-in-buona-salute-possiamo-aspettarci/,Quanti anni in buona salute possiamo aspettarci?,CREATIVITÀ,09/09/2019,"09/10/2020, 12:05:08"
https://nova.ilsole24ore.com/infodata/come-e-cambiato-con-giuseppe-conte-il-volto-della-repubblica-italiana/,Come è cambiato con Giuseppe Conte il volto della Repubblica italiana,CREATIVITÀ,09/09/2019,"09/10/2020, 12:05:08"
https://nova.ilsole24ore.com/infodata/scopri-i-punti-piu-caldi-e-piu-freddi-del-pianeta/,Scopri i punti più caldi e più freddi del Pianeta,CREATIVITÀ,08/09/2019,"09/10/2020, 12:05:08"
https://nova.ilsole24ore.com/infodata/dalle-montagne-piu-alte-agli-abissi-profondi-scopri-i-luoghi-record-del-nostro-pianeta/,"Dalle montagne più alte agli abissi profondi, scopri i luoghi record del nostro Pianeta",CREATIVITÀ,08/09/2019,"09/10/2020, 12:05:09"
https://nova.ilsole24ore.com/infodata/la-mappa-italiana-dellinternet-super-veloce/,La mappa italiana dell'internet super veloce,CREATIVITÀ,08/09/2019,"09/10/2020, 12:05:09"
https://nova.ilsole24ore.com/infodata/retorica-apocalittica-scetticismo-e-felicita-ecco-chi-pensa-cosa-del-cambiamento-climatico/,"Retorica apocalittica, scetticismo e felicità: ecco chi pensa cosa del cambiamento climatico",CREATIVITÀ,08/09/2019,"09/10/2020, 12:05:09"
https://nova.ilsole24ore.com/infodata/antidepressivi-in-tanti-li-usano-in-pochi-lo-fanno-bene/,"Antidepressivi: in tanti li usano, in pochi lo fanno bene",CREATIVITÀ,11/09/2019,"09/10/2020, 12:05:10"
https://nova.ilsole24ore.com/infodata/pil-leuropa-cresce-litalia-solo-a-meta-la-grecia-non-ce-la-fa/,"Pil, l'Europa cresce. L'Italia solo a metà. La Grecia non ce la fa",CREATIVITÀ,10/09/2019,"09/10/2020, 12:05:10"
https://nova.ilsole24ore.com/infodata/quanto-tempo-ci-vuole-per-diventare-milionari-nomi-numeri-e-curiosita-sul-piccolo-popolo-a-seinove-zeri/,"Quanto tempo ci vuole per diventare milionari? Nomi, numeri e curiosità sul piccolo popolo a sei/nove zeri",CREATIVITÀ,10/09/2019,"09/10/2020, 12:05:10"
https://nova.ilsole24ore.com/infodata/unimpresa-su-cinque-e-ambulante-con-picchi-al-sud-e-non-sono-solo-stranieri/,"Un'impresa su cinque è ambulante, con picchi al sud. E non sono solo stranieri",CREATIVITÀ,10/09/2019,"09/10/2020, 12:05:11"
https://nova.ilsole24ore.com/infodata/pompieri-e-poliziotti-morti-a-new-york-per-malattia-dopo-l11-settembre/,Pompieri e poliziotti morti a New York per malattia dopo l'11 settembre,CREATIVITÀ,10/09/2019,"09/10/2020, 12:05:11"
https://nova.ilsole24ore.com/infodata/quante-probabilita-ha-il-governo-conte-bis-di-chiudere-la-legislatura/,Quante probabilità ha il Governo Conte Bis di chiudere la legislatura?,CREATIVITÀ,09/09/2019,"09/10/2020, 12:05:11"
https://nova.ilsole24ore.com/infodata/tutti-i-malware-bloccati-nella-prima-meta-del-2019/,Tutti i malware bloccati nella prima metà del 2019,CREATIVITÀ,05/09/2019,"09/10/2020, 12:05:12"
https://nova.ilsole24ore.com/infodata/quanti-siti-sono-state-creati-sul-web/,Quanti siti sono state creati sul web?,CREATIVITÀ,05/09/2019,"09/10/2020, 12:05:12"
https://nova.ilsole24ore.com/infodata/il-governo-conte-bis-pronto-in-16-giorni-scopri-le-crisi-piu-lunghe-della-storia-repubblicana/,Il Governo Conte Bis pronto in 16 giorni. Scopri le crisi più lunghe della storia repubblicana,CREATIVITÀ,05/09/2019,"09/10/2020, 12:05:12"
https://nova.ilsole24ore.com/infodata/una-nazione-su-due-e-insoddisfatta-della-democrazia-3/,Una nazione su due è insoddisfatta della democrazia,CREATIVITÀ,04/09/2019,"09/10/2020, 12:05:12"
https://nova.ilsole24ore.com/infodata/da-atene-alla-base-di-base-vostok-scopri-i-punti-piu-caldi-e-piu-freddi-del-pianeta/,Da Atene alla base di base Vostok: scopri i punti più caldi e più freddi del Pianeta,CREATIVITÀ,04/09/2019,"09/10/2020, 12:05:13"
https://nova.ilsole24ore.com/infodata/scopri-le-crisi-piu-lunghe-della-storia-repubblicana/,Scopri le crisi più lunghe della storia repubblicana,CREATIVITÀ,04/09/2019,"09/10/2020, 12:05:13"
https://nova.ilsole24ore.com/infodata/i-gatti-randagi-se-la-passano-male-peggio-dei-cani-in-italia/,"I gatti randagi se la passano male, peggio dei cani, in Italia",CREATIVITÀ,08/09/2019,"09/10/2020, 12:05:14"
https://nova.ilsole24ore.com/infodata/misura-leffetto-del-climate-change-sullitalia-il-record-spetta-a-treviso/,Misura l'effetto del climate change sull'Italia. Il record spetta a Treviso,CREATIVITÀ,07/09/2019,"09/10/2020, 12:05:14"
https://nova.ilsole24ore.com/infodata/tre-ambientalisti-uccisi-ogni-settimana-dove-si-muore-e-perche/,Tre ambientalisti uccisi ogni settimana. Dove si muore e perché,CREATIVITÀ,07/09/2019,"09/10/2020, 12:05:14"
https://nova.ilsole24ore.com/infodata/i-gatti-randagi-se-la-passano-male-peggio-dei-cani-in-italia-i-numeri-delle-colonie-feline/,"I gatti randagi se la passano male, peggio dei cani, in Italia. I numeri delle colonie feline",CREATIVITÀ,06/09/2019,"09/10/2020, 12:05:14"
https://nova.ilsole24ore.com/infodata/dalle-montagne-piu-alte-agli-abissi-piu-profondi-scopri-i-luoghi-record-del-nostro-pianeta/,"Dalle montagne più alte agli abissi più profondi, scopri i luoghi record del nostro Pianeta",CREATIVITÀ,06/09/2019,"09/10/2020, 12:05:15"
https://nova.ilsole24ore.com/infodata/banda-ultra-larga-per-7600-comuni-la-mappa-italiana-dellinternet-super-veloce/,Banda ultra larga per 7600 Comuni? La mappa italiana dell'internet super veloce,CREATIVITÀ,05/09/2019,"09/10/2020, 12:05:15"
https://nova.ilsole24ore.com/infodata/scopri-dove-e-piu-regolare-e-frequente-il-lavoro-irregolare-3/,Scopri dove è più regolare (e frequente) il lavoro irregolare,CREATIVITÀ,01/09/2019,"09/10/2020, 12:05:15"
https://nova.ilsole24ore.com/infodata/la-legge-di-murphy-del-climate-change-paga-chi-inquina-di-meno/,La legge di Murphy del climate change: paga chi inquina di meno,CREATIVITÀ,01/09/2019,"09/10/2020, 12:05:16"
https://nova.ilsole24ore.com/infodata/speranza-di-vita-il-record-a-madrid-scopri-la-mappa-europea-2/,"Speranza di vita, il record a Madrid. Scopri la mappa europea",CREATIVITÀ,01/09/2019,"09/10/2020, 12:05:16"
https://nova.ilsole24ore.com/infodata/la-mappa-delle-scoperte-di-4mila-esopianeti-2/,La mappa delle scoperte di 4mila esopianeti,CREATIVITÀ,31/08/2019,"09/10/2020, 12:05:16"
https://nova.ilsole24ore.com/infodata/quanto-contano-in-italia-le-piccole-e-medie-aziende-tutti-i-numeri-2/,Quanto contano in Italia le piccole e medie aziende? Tutti i numeri,CREATIVITÀ,31/08/2019,"09/10/2020, 12:05:17"
https://nova.ilsole24ore.com/infodata/vuoi-sapere-se-la-tua-famiglia-spende-troppo-rispetto-alla-media-2/,Vuoi sapere se la tua famiglia spende troppo (rispetto alla media)?,CREATIVITÀ,31/08/2019,"09/10/2020, 12:05:17"
https://nova.ilsole24ore.com/infodata/occupazione-dei-laureati-italia-del-sud-fanalino-di-coda-in-europa/,Occupazione dei laureati Italia (del sud) fanalino di coda in Europa,CREATIVITÀ,04/09/2019,"09/10/2020, 12:05:17"
https://nova.ilsole24ore.com/infodata/vecchiaia-e-qualita-della-vita-chi-se-la-gode-di-piu/,"Vecchiaia e qualità della vita, chi se la gode di più?",CREATIVITÀ,03/09/2019,"09/10/2020, 12:05:18"
https://nova.ilsole24ore.com/infodata/citta-per-citta-anno-per-anno-ecco-leffetto-del-climate-change-sullitalia/,"Città per città, anno per anno: ecco l'effetto del climate change sull'Italia",CREATIVITÀ,03/09/2019,"09/10/2020, 12:05:18"
https://nova.ilsole24ore.com/infodata/segui-dorian-cento-anni-di-uragani-nelloceano-atlantico/,Segui Dorian. Cento anni di uragani nell'oceano Atlantico,CREATIVITÀ,02/09/2019,"09/10/2020, 12:05:18"
https://nova.ilsole24ore.com/infodata/paura-del-climate-change-retorica-apocalittica-scetticismo-e-felicita-ecco-chi-pensa-cosa/,"Paura del climate change? Retorica apocalittica, scetticismo e felicità: ecco chi pensa cosa",CREATIVITÀ,02/09/2019,"09/10/2020, 12:05:19"
https://nova.ilsole24ore.com/infodata/climate-change-vs-climate-war-tre-ambientalisti-uccisi-ogni-settimana/,Climate change vs climate war: tre ambientalisti uccisi ogni settimana,CREATIVITÀ,02/09/2019,"09/10/2020, 12:05:19"
https://nova.ilsole24ore.com/infodata/roma-milano-le-periferie-e-lo-stato-della-poverta-educativa-2/,"Roma, Milano, le periferie e lo stato della povertà educativa",CREATIVITÀ,30/08/2019,"09/10/2020, 12:05:19"
https://nova.ilsole24ore.com/infodata/ticket-sanitari-nel-2018-ogni-cittadino-ha-speso-di-tasca-propria-491-euro-2/,"Ticket sanitari: nel 2018 ogni cittadino ha speso (di tasca propria) 49,1 euro",CREATIVITÀ,30/08/2019,"09/10/2020, 12:05:20"
https://nova.ilsole24ore.com/infodata/levoluzione-dei-confini-in-italia-dal-1861-a-oggi-2/,L'evoluzione dei confini in Italia dal 1861 a oggi,CREATIVITÀ,30/08/2019,"09/10/2020, 12:05:20"
https://nova.ilsole24ore.com/infodata/a-vernazza-sette-appartamenti-affittabili-su-dieci-sono-su-airbnb-la-mappa-dellitalia-2/,A Vernazza sette appartamenti affittabili su dieci sono su Airbnb. La mappa dell'Italia,CREATIVITÀ,30/08/2019,"09/10/2020, 12:05:20"
https://nova.ilsole24ore.com/infodata/oltre-cento-miliardi-lanno-ecco-dove-colpisce-di-piu-levasione-del-fisco-2/,Oltre cento miliardi l'anno. Ecco dove colpisce di più l'evasione del fisco,CREATIVITÀ,29/08/2019,"09/10/2020, 12:05:21"
https://nova.ilsole24ore.com/infodata/il-sud-ditalia-e-i-settori-che-evadono-di-piu-2/,Il Sud d'Italia e i settori che evadono di più,CREATIVITÀ,29/08/2019,"09/10/2020, 12:05:21"
https://nova.ilsole24ore.com/infodata/oltre-il-pil-servirebbe-misurare-la-salute-mentale-della-popolazione-2/,Oltre il Pil: servirebbe misurare la salute mentale della popolazione,CREATIVITÀ,29/08/2019,"09/10/2020, 12:05:21"
