Link,Titolo,Categoria,Data_pubblicazione,Timestamp dello scraping
https://nova.ilsole24ore.com/infodata/trenta-giorni-di-lockdown-in-italia-in-dieci-grafici-laltro-racconto-della-diffusione-dei-dati/,Trenta giorni di lockdown in Italia in dieci grafici. L'altro racconto della diffusione (dei dati),CREATIVITÀ,12/04/2020,"09/10/2020, 12:02:03"
https://nova.ilsole24ore.com/infodata/covid-19-come-sta-andando-il-contagio-in-campania-tutti-i-numeri/,"Covid-19, come sta andando il contagio in Campania? Tutti i numeri",CREATIVITÀ,17/04/2020,"09/10/2020, 12:02:04"
https://nova.ilsole24ore.com/infodata/italiani-grandi-citta-e-spazi-abitativi-quanto-sono-piccole-le-nostre-case/,"Italiani, grandi città e spazi abitativi. Quanto sono piccole le nostre case?",CREATIVITÀ,17/04/2020,"09/10/2020, 12:02:04"
https://nova.ilsole24ore.com/infodata/covid-19-decessi-e-case-di-riposo-in-lombardia-proviamo-incrociare-i-dati/,"Covid-19, decessi e case di riposo in Lombardia. Proviamo incrociare i dati",CREATIVITÀ,16/04/2020,"09/10/2020, 12:02:04"
https://nova.ilsole24ore.com/infodata/decessi-con-o-per-il-coronavirus-il-rebus-della-statistica-della-mortalita/,"Decessi ""con"" o ""per"" il coronavirus? Il rebus della statistica della mortalità",CREATIVITÀ,16/04/2020,"09/10/2020, 12:02:05"
https://nova.ilsole24ore.com/infodata/covid-19-la-mappa-delle-emozioni-degli-italiani-in-una-mappa/,"Covid-19, la mappa delle emozioni degli italiani in una mappa",CREATIVITÀ,15/04/2020,"09/10/2020, 12:02:05"
https://nova.ilsole24ore.com/infodata/il-cielo-sopra-leuropa-non-e-mai-stato-cosi-vuoto-i-numeri-del-traffico-aereo-in-lockdown/,Il cielo sopra l'Europa non è mai stato così vuoto. I numeri del traffico aereo in lockdown,CREATIVITÀ,15/04/2020,"09/10/2020, 12:02:05"
https://nova.ilsole24ore.com/infodata/la-regione-lombardia-sovrastima-i-guariti-da-covid-19-laccusa-della-fondazione-gimbe/,"La Regione Lombardia sovrastima i guariti da Covid-19, l'accusa della Fondazione Gimbe",CREATIVITÀ,10/04/2020,"09/10/2020, 12:02:05"
https://nova.ilsole24ore.com/infodata/coronavirus-e-migranti-riprendono-gli-sbarchi-i-numeri-delle-due-emergenze/,"Coronavirus e migranti, riprendono gli sbarchi. I numeri delle due emergenze",CREATIVITÀ,10/04/2020,"09/10/2020, 12:02:06"
https://nova.ilsole24ore.com/infodata/la-scuola-in-lockdown-a-casa-quasi-due-miliardi-di-studenti-in-tutto-il-mondo/,La scuola in lockdown. A casa quasi due miliardi di studenti in tutto il mondo,CREATIVITÀ,10/04/2020,"09/10/2020, 12:02:06"
https://nova.ilsole24ore.com/infodata/covid-19-come-sta-andando-lepidemia-in-liguria-tutti-i-dati-pubblicati-finora/,"Covid-19, come sta andando l'epidemia in Liguria? Tutti i dati pubblicati, finora",CREATIVITÀ,09/04/2020,"09/10/2020, 12:02:06"
https://nova.ilsole24ore.com/infodata/trenta-giorni-di-lockdown-in-italia-raccontati-in-dieci-grafici/,Trenta giorni di lockdown in Italia raccontati in dieci grafici,CREATIVITÀ,09/04/2020,"09/10/2020, 12:02:07"
https://nova.ilsole24ore.com/infodata/quanti-soldi-stanzia-leuropa-per-la-ricerca-sul-coronavirus/,Quanti soldi stanzia l'Europa per la ricerca sul coronavirus?,CREATIVITÀ,08/04/2020,"09/10/2020, 12:02:07"
https://nova.ilsole24ore.com/infodata/lorologia-dellapocalisse-cento-secondi-alle-fine-del-mondo-e-non-e-colpa-del-coronavirus/,"L'orologia dell'apocalisse, cento secondi alle fine del mondo. E non è colpa del coronavirus",CREATIVITÀ,11/04/2020,"09/10/2020, 12:02:07"
https://nova.ilsole24ore.com/infodata/in-lombardia-i-comuni-dove-il-coronavirus-ha-colpito-di-piu-gli-anziani-il-caso-di-casalmorano/,In Lombardia i Comuni dove il coronavirus ha colpito di più gli anziani. Il caso di Casalmorano,CREATIVITÀ,11/04/2020,"09/10/2020, 12:02:07"
https://nova.ilsole24ore.com/infodata/covid-19-cronaca-della-diffusione-dei-dati-le-storia-dietro-ai-numeri-seconda-puntata/,"Covid-19, cronaca della diffusione (dei dati). Le storia dietro ai numeri (seconda puntata)",CREATIVITÀ,11/04/2020,"09/10/2020, 12:02:08"
https://nova.ilsole24ore.com/infodata/i-nuovi-poveri-limpatto-del-coronavirus-sulle-disparita-della-nostra-societa/,I nuovi poveri: l'impatto del coronavirus sulle disparità della nostra società,CREATIVITÀ,11/04/2020,"09/10/2020, 12:02:08"
https://nova.ilsole24ore.com/infodata/coronavirus-dati-analisi-e-simulazioni-una-selezione-di-fonti-e-luoghi-di-discussione-online-aggiornato-5/,"Coronavirus: dati, analisi e simulazioni. Una selezione di fonti e luoghi di discussione online (aggiornato)",CREATIVITÀ,11/04/2020,"09/10/2020, 12:02:08"
https://nova.ilsole24ore.com/infodata/il-coronavirus-in-lombardia-972mila-contagiati-e-15mila-morti-lanalisi-di-intwig/,Il Coronavirus in Lombardia: 972mila contagiati e 15mila morti. L'analisi di InTwig,CREATIVITÀ,10/04/2020,"09/10/2020, 12:02:09"
https://nova.ilsole24ore.com/infodata/coronavirus-cronaca-della-diffusione-dei-dati-le-storia-dietro-ai-numeri-seconda-puntata/,"Coronavirus, cronaca della diffusione (dei dati). Le storia dietro ai numeri (seconda puntata)",CREATIVITÀ,06/04/2020,"09/10/2020, 12:02:09"
https://nova.ilsole24ore.com/infodata/coronavisus-cronaca-della-diffusione-dei-dati-le-storia-dietro-ai-numeri-seconda-puntata/,"Coronavisus, cronaca della diffusione (dei dati). Le storia dietro ai numeri (seconda puntata)",CREATIVITÀ,06/04/2020,"09/10/2020, 12:02:09"
https://nova.ilsole24ore.com/infodata/investire-in-sanita-limpatto-del-coronavirus-sulle-disuguaglianze/,Investire in sanità? L'impatto del coronavirus sulle disuguaglianze,CREATIVITÀ,06/04/2020,"09/10/2020, 12:02:09"
https://nova.ilsole24ore.com/infodata/dati-e-coronavirus-aiutateci-a-mappare-chi-condivide-e-cosa-aggiornato/,Dati e coronavirus. Aiutateci a mappare chi condivide e cosa (aggiornato),CREATIVITÀ,06/04/2020,"09/10/2020, 12:02:10"
https://nova.ilsole24ore.com/infodata/coronavirus-mortalita-e-profilo-demografico-nella-citta-milano/,"Coronavirus, mortalità e profilo demografico nella città Milano",CREATIVITÀ,05/04/2020,"09/10/2020, 12:02:10"
https://nova.ilsole24ore.com/infodata/covid-19-come-sta-andando-lepidemia-in-toscana/,"Covid-19, come sta andando l'epidemia in Toscana?",CREATIVITÀ,05/04/2020,"09/10/2020, 12:02:10"
https://nova.ilsole24ore.com/infodata/litalia-e-pronta-per-la-didattica-a-distanza-al-sud-e-nei-piccoli-comuni-ce-un-problema/,L'Italia è pronta per la didattica a distanza? Al Sud e nei piccoli comuni c'è un problema,CREATIVITÀ,08/04/2020,"09/10/2020, 12:02:11"
https://nova.ilsole24ore.com/infodata/il-nuovo-vocabolario-del-coronavirus-piu-del-virus-spaventa-la-mancanza-di-liberta/,"Il nuovo vocabolario del coronavirus, più del virus spaventa la mancanza di libertà",CREATIVITÀ,07/04/2020,"09/10/2020, 12:02:11"
https://nova.ilsole24ore.com/infodata/doomsday-clock-cento-secondo-alle-fine-del-mondo-ma-non-e-colpa-del-coronavirus/,"Doomsday clock, cento secondo alle fine del mondo. Ma non è colpa del coronavirus",CREATIVITÀ,07/04/2020,"09/10/2020, 12:02:11"
https://nova.ilsole24ore.com/infodata/doomsday-clock-cento-secondi-alle-fine-del-mondo-ma-non-e-colpa-del-coronavirus/,"Doomsday clock, cento secondi alle fine del mondo. Ma non è colpa del coronavirus",CREATIVITÀ,07/04/2020,"09/10/2020, 12:02:11"
https://nova.ilsole24ore.com/infodata/lombardia-ecco-i-comuni-dove-il-coronavirus-ha-colpito-di-piu-gli-anziani/,"Lombardia, ecco i Comuni dove il coronavirus ha colpito di più gli anziani",CREATIVITÀ,07/04/2020,"09/10/2020, 12:02:12"
https://nova.ilsole24ore.com/infodata/coronavirus-e-calato-il-traffico-in-auto-in-lombardia%e2%80%89i-casi-di-milano-e-monza/,"Coronavirus, è calato il traffico in auto in Lombardia? I casi di Milano e Monza",CREATIVITÀ,06/04/2020,"09/10/2020, 12:02:12"
https://nova.ilsole24ore.com/infodata/diritto-allinformazione-e-coronavirus-perche-e-stato-sospeso-temporaneamente-il-foia/,Diritto all'informazione e coronavirus: perché è stato sospeso temporaneamente il Foia?,CREATIVITÀ,05/04/2020,"09/10/2020, 12:02:12"
https://nova.ilsole24ore.com/infodata/perche-calcolare-i-casi-positivi-ogni-cento-tamponi-effettuati/,Perché calcolare i casi positivi ogni cento tamponi effettuati?,CREATIVITÀ,05/04/2020,"09/10/2020, 12:02:12"
https://nova.ilsole24ore.com/infodata/covid-19-i-decessi-sono-raddoppiati-ecco-la-mappa-delle-mortalita-comune-per-comune/,"Covid-19: i decessi sono raddoppiati, ecco la mappa delle mortalità comune per comune",CREATIVITÀ,05/04/2020,"09/10/2020, 12:02:13"
https://nova.ilsole24ore.com/infodata/risorse-per-monitorare-covid-19-ecco-il-dataset-offerto-da-google/,Risorse per monitorare Covid-19: ecco il dataset offerto da Google,CREATIVITÀ,05/04/2020,"09/10/2020, 12:02:13"
https://nova.ilsole24ore.com/infodata/sette-giorni-dopo-il-lockdown-40-delle-assunzioni-su-linkedin-i-numeri-di-italia-e-cina/,Sette giorni dopo il lockdown -40% delle assunzioni su LinkedIn. I numeri di Italia e Cina,CREATIVITÀ,04/04/2020,"09/10/2020, 12:02:13"
https://nova.ilsole24ore.com/infodata/chi-sta-a-casa-chi-si-muove-e-chi-va-al-lavoro-la-mobilita-regionale-dellitalia-in-quarantena/,"Chi sta a casa, chi si muove e chi va al lavoro. La mobilità regionale dell'Italia in quarantena",CREATIVITÀ,04/04/2020,"09/10/2020, 12:02:14"
https://nova.ilsole24ore.com/infodata/covid-19-ecco-leffetto-della-quarantena-sulla-qualita-dellaria-in-lombardia/,"Covid-19, ecco l'effetto della quarantena sulla qualità dell'aria in Lombardia",CREATIVITÀ,04/04/2020,"09/10/2020, 12:02:14"
https://nova.ilsole24ore.com/infodata/coronavirus-dati-analisi-e-simulazioni-una-selezione-di-fonti-e-luoghi-di-discussione-online-aggiornato-4/,"Coronavirus: dati, analisi e simulazioni. Una selezione di fonti e luoghi di discussione online (aggiornato)",CREATIVITÀ,04/04/2020,"09/10/2020, 12:02:14"
https://nova.ilsole24ore.com/infodata/italiani-in-lockdown-ansia-insicurezza-e-smartphone-ecco-come-siamo-cambiati/,"Italiani in lockdown: ansia, insicurezza e smartphone. Ecco come siamo cambiati",CREATIVITÀ,03/04/2020,"09/10/2020, 12:02:14"
https://nova.ilsole24ore.com/infodata/coronavirus-a-marzo-anche-a-milano-la-mortalita-e-raddoppiata/,"Coronavirus, a marzo anche a Milano la mortalità è raddoppiata",CREATIVITÀ,03/04/2020,"09/10/2020, 12:02:15"
https://nova.ilsole24ore.com/infodata/covid-19-come-sta-andando-lepidemia-in-toscana-i-dati-aggiornati/,"Covid-19, come sta andando l'epidemia in Toscana? I dati aggiornati",CREATIVITÀ,03/04/2020,"09/10/2020, 12:02:15"
https://nova.ilsole24ore.com/infodata/coronavirus-dati-analisi-e-simulazioni-una-selezione-di-fonti-e-luoghi-di-discussione-online-aggiornato-3/,"Coronavirus: dati, analisi e simulazioni. Una selezione di fonti e luoghi di discussione online (aggiornato)",CREATIVITÀ,03/04/2020,"09/10/2020, 12:02:15"
https://nova.ilsole24ore.com/infodata/chi-sta-a-casa-chi-si-muove-e-chi-va-al-lavoro-la-mappa-della-mobilita/,"Chi sta a casa, chi si muove e chi va al lavoro. La mappa della mobilità",CREATIVITÀ,31/03/2020,"09/10/2020, 12:02:16"
https://nova.ilsole24ore.com/infodata/nonni-e-nipoti-quanto-pesa-la-demografia-italiana-sul-boom-di-contagi/,"Nonni e nipoti, quanto pesa la demografia italiana sul boom di contagi",CREATIVITÀ,31/03/2020,"09/10/2020, 12:02:16"
https://nova.ilsole24ore.com/infodata/rallentamento-la-mappa-del-contagio-delleuropean-centre-for-disease-prevention-and-control/,Rallentamento? La mappa del contagio dell'European Centre for Disease Prevention and Control,CREATIVITÀ,31/03/2020,"09/10/2020, 12:02:16"
https://nova.ilsole24ore.com/infodata/sette-giorni-dopo-il-lockdown-40-delle-assunzioni-su-linkedin-in-italia/,Sette giorni dopo il lockdown -40% delle assunzioni su LinkedIn in Italia,CREATIVITÀ,30/03/2020,"09/10/2020, 12:02:16"
https://nova.ilsole24ore.com/infodata/come-sta-andando-lepidemia-del-coronavirus-in-piemonte-ecco-quali-indicatori-vanno-monitorati/,Come sta andando l'epidemia del coronavirus in Piemonte? Ecco quali indicatori vanno monitorati,CREATIVITÀ,30/03/2020,"09/10/2020, 12:02:17"
https://nova.ilsole24ore.com/infodata/leffetto-covid-19-sullinquinamento-nelle-citta-lombarde/,L'effetto Covid-19 sull'inquinamento nelle città lombarde,CREATIVITÀ,30/03/2020,"09/10/2020, 12:02:17"
https://nova.ilsole24ore.com/infodata/come-il-coronavirus-sta-condizionando-la-corsa-alle-presidenziali-usa-secondo-fivethirty-eight/,Come il coronavirus sta condizionando la corsa alle presidenziali Usa (secondo FiveThirty Eight),CREATIVITÀ,02/04/2020,"09/10/2020, 12:02:17"
https://nova.ilsole24ore.com/infodata/la-matematica-dietro-al-social-distancing-in-un-video/,La matematica dietro al social distancing in un video,CREATIVITÀ,02/04/2020,"09/10/2020, 12:02:18"
https://nova.ilsole24ore.com/infodata/epidemia-covid-19-la-mappa-sulla-mortalita-citta-per-citta-dal-2015-a-marzo-di-questanno/,Epidemia Covid-19: la mappa sulla mortalità città per città dal 2015 a marzo di quest'anno,CREATIVITÀ,01/04/2020,"09/10/2020, 12:02:18"
https://nova.ilsole24ore.com/infodata/perche-e-stato-sospeso-temporaneamente-il-foia/,Perché è stato sospeso temporaneamente il Foia?,CREATIVITÀ,01/04/2020,"09/10/2020, 12:02:18"
https://nova.ilsole24ore.com/infodata/positivi-e-tamponi-che-succede-se-si-prova-a-normalizzare-il-dato/,Positivi e tamponi: che succede se si prova a normalizzare il dato?,CREATIVITÀ,01/04/2020,"09/10/2020, 12:02:19"
https://nova.ilsole24ore.com/infodata/nasce-il-covid-19-public-dataset-program-e-offre-luso-di-big-query/,Nasce il COVID-19 Public Dataset Program (e offre l'uso di Big Query),CREATIVITÀ,31/03/2020,"09/10/2020, 12:02:19"
https://nova.ilsole24ore.com/infodata/dati-e-coronavirus-ogni-regione-va-per-conto-suo-aiutateci-a-mappare-chi-condivide-e-cosa-aggiornato-2/,"Dati e coronavirus, ogni Regione va per conto suo. Aiutateci a mappare chi condivide e cosa (aggiornato)",CREATIVITÀ,29/03/2020,"09/10/2020, 12:02:19"
https://nova.ilsole24ore.com/infodata/covid-19-i-limiti-e-la-comprensione-dei-dati-che-ogni-giorno-comunica-la-protezione-civile/,"Covid-19, i limiti e la comprensione dei dati che ogni giorno comunica la Protezione civile",CREATIVITÀ,29/03/2020,"09/10/2020, 12:02:20"
https://nova.ilsole24ore.com/infodata/covid-19-la-regione-emilia-romagna-come-sta-affrontando-il-contagio/,"Covid-19, la regione Emilia Romagna come sta affrontando il contagio?",CREATIVITÀ,29/03/2020,"09/10/2020, 12:02:20"
https://nova.ilsole24ore.com/infodata/tutti-a-casa-dove-vivono-gli-isolati-nel-mondo-ecco-il-mondo-dove-non-arrivano-le-strade/,"Tutti a casa. Dove vivono gli ""isolati"" nel mondo? Ecco il mondo dove non arrivano le strade",CREATIVITÀ,29/03/2020,"09/10/2020, 12:02:20"
https://nova.ilsole24ore.com/infodata/le-paure-degli-italiani-per-le-conseguenze-del-coronavirus-e-linterpretazione-dei-sondaggi/,Le paure degli italiani per le conseguenze del coronavirus e l'interpretazione dei sondaggi,CREATIVITÀ,28/03/2020,"09/10/2020, 12:02:21"
https://nova.ilsole24ore.com/infodata/come-stava-leuropa-prima-del-coronavirus-i-numeri-delle-economie-piu-ricche/,Come stava l'Europa prima del coronavirus? I numeri delle economie più ricche,CREATIVITÀ,28/03/2020,"09/10/2020, 12:02:21"
https://nova.ilsole24ore.com/infodata/il-veneto-sta-affrontando-meglio-di-altre-regioni-lemergenza-del-coronavirus/,Il Veneto sta affrontando meglio di altre regioni l'emergenza del coronavirus ?,CREATIVITÀ,28/03/2020,"09/10/2020, 12:02:21"
https://nova.ilsole24ore.com/infodata/il-coronavirus-spiegato-bene-in-un-video-con-immagini-disegni-e-parole/,"Il coronavirus spiegato bene in un video con immagini, disegni e parole",CREATIVITÀ,28/03/2020,"09/10/2020, 12:02:21"
https://nova.ilsole24ore.com/infodata/coronavirus-cronaca-critica-della-diffusione-dei-dati-prima-puntata/,Coronavirus: cronaca critica della diffusione (dei dati). Prima puntata,CREATIVITÀ,28/03/2020,"09/10/2020, 12:02:21"
https://nova.ilsole24ore.com/infodata/covid-19-come-interpretare-i-dati-che-ogni-giorno-comunica-la-protezione-civile/,"Covid-19, come interpretare i dati che ogni giorno comunica la Protezione civile",CREATIVITÀ,27/03/2020,"09/10/2020, 12:02:22"
https://nova.ilsole24ore.com/infodata/stati-uniti-primo-paese-al-mondo-per-contagi-piu-di-italia-e-cina/,Stati uniti primo paese al mondo per contagi (più di Italia e Cina),CREATIVITÀ,27/03/2020,"09/10/2020, 12:02:22"
https://nova.ilsole24ore.com/infodata/covid-19-la-situazione-dellepidemia-in-emilia-romagna/,"Covid-19, la situazione dell'epidemia in Emilia Romagna",CREATIVITÀ,26/03/2020,"09/10/2020, 12:02:22"
https://nova.ilsole24ore.com/infodata/coronavirus-dati-analisi-e-simulazioni-una-selezione-di-fonti-e-luoghi-di-discussione-online-aggiornato-2/,"Coronavirus: dati, analisi e simulazioni. Una selezione di fonti e luoghi di discussione online (aggiornato)",CREATIVITÀ,26/03/2020,"09/10/2020, 12:02:22"
https://nova.ilsole24ore.com/infodata/tutti-a-casa-dove-vivono-gli-italiani-51-milioni-in-citta-il-resto-nelle-aree-rurali-ecco-il-mondo-senza-strade/,"Tutti a casa. Dove vivono gli italiani? 51 milioni in città, il resto nelle aree rurali. Ecco il mondo senza strade",CREATIVITÀ,26/03/2020,"09/10/2020, 12:02:22"
https://nova.ilsole24ore.com/infodata/come-stava-leuropa-prima-del-coronavirus-lhow-is-life-dellocse-un-classico-dellera-pre-contagio/,"Come stava l'Europa prima del coronavirus? L'How is life dell'Ocse, un classico dell'era pre-contagio",CREATIVITÀ,25/03/2020,"09/10/2020, 12:02:23"
https://nova.ilsole24ore.com/infodata/covid-19-aumentare-i-tamponi-riduce-i-contagi-lombardia-e-veneto-a-confronto/,"Covid-19, aumentare i tamponi riduce i contagi? Lombardia e Veneto a confronto",CREATIVITÀ,25/03/2020,"09/10/2020, 12:02:23"
https://nova.ilsole24ore.com/infodata/covid-19-aumentare-i-tamponi-riduce-i-contati-lombardia-e-veneto-a-confronto/,"Covid-19, aumentare i tamponi riduce i contati? Lombardia e Veneto a confronto",CREATIVITÀ,25/03/2020,"09/10/2020, 12:02:23"
https://nova.ilsole24ore.com/infodata/nasce-cura-progetto-open-source-per-costruire-unita-di-terapia-intensiva/,"Nasce Cura, progetto open-source per costruire unità di terapia intensiva",CREATIVITÀ,24/03/2020,"09/10/2020, 12:02:24"
https://nova.ilsole24ore.com/infodata/le-paure-degli-italiani-per-le-conseguenze-del-coronavirus-lindagine-di-swg/,Le paure degli italiani per le conseguenze del coronavirus. L'indagine di Swg,CREATIVITÀ,24/03/2020,"09/10/2020, 12:02:24"
https://nova.ilsole24ore.com/infodata/coronavirus-il-modello-veneto-spiegato-con-i-numeri-perche-ha-percentuali-di-ricoveri-piu-basse/,"Coronavirus, il modello Veneto spiegato con i numeri. Perché ha percentuali di ricoveri più basse?",CREATIVITÀ,24/03/2020,"09/10/2020, 12:02:24"
https://nova.ilsole24ore.com/infodata/il-coronavirus-spiegato-bene-in-un-video-con-le-immagini-disegni-e-parole/,"Il coronavirus spiegato bene in un video con le immagini, disegni e parole",CREATIVITÀ,23/03/2020,"09/10/2020, 12:02:25"
https://nova.ilsole24ore.com/infodata/coronavirus-cronaca-vera-della-diffusione-dei-dati-una-storia-molto-italiana/,Coronavirus: cronaca vera della diffusione (dei dati). Una storia molto italiana,CREATIVITÀ,23/03/2020,"09/10/2020, 12:02:25"
https://nova.ilsole24ore.com/infodata/dati-e-coronavirus-ogni-regione-va-per-conto-suo-aiutateci-a-mappare-chi-condivide-e-cosa-aggiornato/,"Dati e coronavirus, ogni Regione va per conto suo. Aiutateci a mappare chi condivide e cosa (aggiornato)",CREATIVITÀ,22/03/2020,"09/10/2020, 12:02:25"
https://nova.ilsole24ore.com/infodata/coronavirus-lautonomia-dei-dati-lombarda-e-la-mappa-nazionale/,"Coronavirus, l'autonomia (dei dati) lombarda e la mappa (nazionale)",CREATIVITÀ,22/03/2020,"09/10/2020, 12:02:26"
https://nova.ilsole24ore.com/infodata/coronavirus-quanto-spazio-hanno-a-disposizione-gli-italiani-la-classifica-stiamoacasa/,Coronavirus: quanto spazio hanno a disposizione gli italiani? La classifica. #stiamoacasa,CREATIVITÀ,21/03/2020,"09/10/2020, 12:02:26"
https://nova.ilsole24ore.com/infodata/ricoveri-ti-e-tamponi-quali-sono-adesso-gli-indicatori-per-capire-come-va-il-contagio/,"Ricoveri, Ti e tamponi. Quali sono adesso gli indicatori per capire come va il contagio?",CREATIVITÀ,21/03/2020,"09/10/2020, 12:02:27"
https://nova.ilsole24ore.com/infodata/coronavirus-dati-analisi-e-simulazioni-una-selezione-di-fonti-e-luoghi-di-discussione-online-aggiornato/,"Coronavirus: dati, analisi e simulazioni. Una selezione di fonti e luoghi di discussione online (aggiornato)",CREATIVITÀ,20/03/2020,"09/10/2020, 12:02:27"
https://nova.ilsole24ore.com/infodata/dati-e-coronavirus-ogni-regione-va-per-conto-suo-aiutateci-a-mappa-chi-condivide-e-cosa/,"Dati e coronavirus, ogni Regione va per conto suo. Aiutateci a mappa chi condivide e cosa",CREATIVITÀ,20/03/2020,"09/10/2020, 12:02:28"
https://nova.ilsole24ore.com/infodata/contagi-e-anziani-ecco-dove-il-coronavirus-rischia-di-provocare-piu-vittime/,"Contagi e anziani, ecco dove il coronavirus rischia di provocare più vittime",CREATIVITÀ,19/03/2020,"09/10/2020, 12:02:28"
https://nova.ilsole24ore.com/infodata/coronavirus-lautonomia-dei-dati-lombarda-e-la-mappa-nazionale-della-protezione-civile/,"Coronavirus, l'autonomia (dei dati) lombarda e la mappa (nazionale) della protezione civile",CREATIVITÀ,19/03/2020,"09/10/2020, 12:02:28"
https://nova.ilsole24ore.com/infodata/demografia-contagi-e-anziani-ecco-le-province-dove-il-coronavirus-rischia-di-provocare-piu-vittime/,"Demografia, contagi e anziani: ecco le province dove il coronavirus rischia di provocare più vittime",CREATIVITÀ,22/03/2020,"09/10/2020, 12:02:29"
https://nova.ilsole24ore.com/infodata/quale-sara-limpatto-del-coronavirus-sulleconomia-mondiale-le-stime-e-gli-scenari-formulati-fino-ad-adesso/,Quale sarà l'impatto del coronavirus sull'economia mondiale? Le stime e gli scenari formulati fino ad adesso,CREATIVITÀ,22/03/2020,"09/10/2020, 12:02:29"
https://nova.ilsole24ore.com/infodata/le-cause-di-morte-in-italia-e-il-coronavirus-lanalisi-sui-decessi-e-le-proiezioni/,Le cause di morte in Italia e il coronavirus. L'analisi sui decessi e le proiezioni,CREATIVITÀ,22/03/2020,"09/10/2020, 12:02:30"
https://nova.ilsole24ore.com/infodata/nasce-il-covid-19-open-research-dataset-29mila-articoli-scientifici-per-lintelligenza-artificiale/,Nasce il Covid-19 Open Research Dataset: 29mila articoli scientifici per l'intelligenza artificiale,CREATIVITÀ,21/03/2020,"09/10/2020, 12:02:30"
https://nova.ilsole24ore.com/infodata/mancano-sette-sedute-per-stabilire-se-il-primo-trimestre-del-2020-sara-il-peggiore-della-storia-delle-borse/,Mancano sette sedute per stabilire se il primo trimestre del 2020 sarà il peggiore della storia delle Borse,CREATIVITÀ,21/03/2020,"09/10/2020, 12:02:31"
https://nova.ilsole24ore.com/infodata/coronavirus-come-sta-andando-la-normale-stagione-influenzale/,"Coronavirus, come sta andando la ""normale"" stagione influenzale?",CREATIVITÀ,21/03/2020,"09/10/2020, 12:02:32"
https://nova.ilsole24ore.com/infodata/coronavirus-in-otto-sedute-le-borse-europee-hanno-bruciato-un-quarto-del-loro-valore/,"Coronavirus, in otto sedute le borse europee hanno bruciato un quarto del loro valore",CREATIVITÀ,18/03/2020,"09/10/2020, 12:02:32"
https://nova.ilsole24ore.com/infodata/quanto-costera-il-coronavirus-alleconomia-mondiale-le-stime-di-fmi-ocse-e-cerved/,"Quanto costerà il Coronavirus all'economia mondiale? Le stime di Fmi, Ocse e Cerved",CREATIVITÀ,18/03/2020,"09/10/2020, 12:02:33"
https://nova.ilsole24ore.com/infodata/il-coronavirus-sara-la-causa-di-morte-in-italia-piu-frequente-nel-2020/,Il Coronavirus sarà la causa di morte in Italia più frequente nel 2020?,CREATIVITÀ,18/03/2020,"09/10/2020, 12:02:33"
https://nova.ilsole24ore.com/infodata/nasce-il-covid-19-open-research-dataset-29mila-articoli-scientifici-a-disposizione-dellai/,Nasce il Covid-19 Open Research Dataset: 29mila articoli scientifici a disposizione dell'Ai,CREATIVITÀ,17/03/2020,"09/10/2020, 12:02:33"
https://nova.ilsole24ore.com/infodata/sei-milanesi-su-dieci-non-si-sono-recati-sul-posto-di-lavoro-limpatto-del-decreto-tuttiacasa/,Sei milanesi su dieci non si sono recati sul posto di lavoro. L'impatto del decreto #tuttiacasa,CREATIVITÀ,17/03/2020,"09/10/2020, 12:02:33"
https://nova.ilsole24ore.com/infodata/coronavirus-e-divieto-di-allontanarsi-dal-comune-di-residenza-quanto-spazio-hanno-a-disposizione-gli-italiani/,Coronavirus e divieto di allontanarsi dal Comune di residenza: quanto spazio hanno a disposizione gli italiani?,CREATIVITÀ,17/03/2020,"09/10/2020, 12:02:34"
https://nova.ilsole24ore.com/infodata/non-solo-coronavirus-come-sta-andando-la-normale-stagione-influenzale-il-confrono/,"Non solo Coronavirus, come sta andando la ""normale"" stagione influenzale? Il confrono",CREATIVITÀ,16/03/2020,"09/10/2020, 12:02:34"
https://nova.ilsole24ore.com/infodata/non-solo-coronavirus-come-sta-andando-la-normale-stagione-influenzale-il-confronto/,"Non solo Coronavirus, come sta andando la ""normale"" stagione influenzale? Il confronto",CREATIVITÀ,16/03/2020,"09/10/2020, 12:02:34"
https://nova.ilsole24ore.com/infodata/la-previsione-dei-contagi-e-delle-terapie-intensive-lo-studio-dellistituto-mario-negri/,La previsione dei contagi e delle terapie intensive. Lo studio dell'Istituto Mario Negri,CREATIVITÀ,16/03/2020,"09/10/2020, 12:02:34"
https://nova.ilsole24ore.com/infodata/ricoveri-ti-e-tamponi-gli-indicatori-per-capire-come-va-il-contagio/,"Ricoveri, Ti e tamponi. Gli indicatori per capire come va il contagio",CREATIVITÀ,16/03/2020,"09/10/2020, 12:02:35"
https://nova.ilsole24ore.com/infodata/coronavirus-dati-analisi-e-similazioni-una-selezione-di-fonti-e-luoghi-di-discussione-online/,"Coronavirus: dati, analisi e similazioni. Una selezione di fonti e luoghi di discussione online",CREATIVITÀ,15/03/2020,"09/10/2020, 12:02:35"
https://nova.ilsole24ore.com/infodata/il-coronavirus-e-piu-letale-in-italia-i-dati-spiegati-bene/,Il Coronavirus è più letale in Italia? I dati spiegati bene,CREATIVITÀ,15/03/2020,"09/10/2020, 12:02:35"
