Link,Titolo,Categoria,Data_pubblicazione,Timestamp dello scraping
https://nova.ilsole24ore.com/infodata/where-are-they-guida-terrestre-per-avvistamenti-extraterrestri/,"""Where are they?"": guida terrestre per avvistamenti extraterrestri",CREATIVITÀ,18/01/2019,"09/10/2020, 12:08:50"
https://nova.ilsole24ore.com/infodata/due-per-mille-sette-milioni-di-euro-al-pd-tre-alla-lega-che-fine-hanno-fatto-i-partiti/,"Due per mille: sette milioni di euro al Pd, tre alla Lega. Che fine hanno fatto i partiti?",CREATIVITÀ,18/01/2019,"09/10/2020, 12:08:50"
https://nova.ilsole24ore.com/infodata/escherichia-coli-e-resistenza-ai-farmaci-ecco-perche-ce-da-preoccuparsi/,Escherichia coli e resistenza ai farmaci: ecco perché c'è da preoccuparsi,CREATIVITÀ,17/01/2019,"09/10/2020, 12:08:51"
https://nova.ilsole24ore.com/infodata/il-calcio-batte-il-cinema-3-a-zero-quanto-spendono-le-province-per-lintrattenimento/,Il calcio batte il cinema 3 a zero. Quanto spendono le province per l'intrattenimento?,CREATIVITÀ,17/01/2019,"09/10/2020, 12:08:51"
https://nova.ilsole24ore.com/infodata/dove-vorrebbero-andare-i-migranti-negli-usa-litalia-e-come-il-giappone/,Dove vorrebbero andare i migranti? Negli Usa. L'Italia è come il Giappone,CREATIVITÀ,16/01/2019,"09/10/2020, 12:08:51"
https://nova.ilsole24ore.com/infodata/pensioni-tutti-i-rischi-della-longevita-nel-paese-piu-vecchio-del-mondo/,"Pensioni, tutti i rischi della longevità nel Paese più vecchio del mondo",CREATIVITÀ,16/01/2019,"09/10/2020, 12:08:52"
https://nova.ilsole24ore.com/infodata/i-suicidi-misurano-il-malessere-di-una-nazione-i-casi-di-russia-e-stati-uniti/,I suicidi misurano il malessere di una nazione? I casi di Russia e Stati Uniti,CREATIVITÀ,15/01/2019,"09/10/2020, 12:08:52"
https://nova.ilsole24ore.com/infodata/malattia-mentale-e-disagio-costeranno16-trilioni-di-dollari-entra-il-2030/,Malattia mentale e disagio costeranno16 trilioni di dollari entra il 2030,CREATIVITÀ,15/01/2019,"09/10/2020, 12:08:52"
https://nova.ilsole24ore.com/infodata/nessuno-ama-il-cinema-come-i-francesi-il-caso-italia-e-il-confronto-europeo/,Nessuno ama il cinema come i francesi. Il caso Italia e il confronto europeo,CREATIVITÀ,14/01/2019,"09/10/2020, 12:08:53"
https://nova.ilsole24ore.com/infodata/come-stanno-davvero-di-salute-i-migranti-irregolari/,Come stanno davvero di salute i migranti irregolari?,CREATIVITÀ,14/01/2019,"09/10/2020, 12:08:53"
https://nova.ilsole24ore.com/infodata/tra-i-30-anni-piu-caldi-dal-1800-ad-oggi-25-sono-successivi-al-1990/,Tra i 30 anni più caldi dal 1800 ad oggi 25 sono successivi al 1990,CREATIVITÀ,13/01/2019,"09/10/2020, 12:08:54"
https://nova.ilsole24ore.com/infodata/chiedete-piu-sicurezza-assumete-poliziotti-le-correlazioni-con-i-reati/,Chiedete più sicurezza? Assumete poliziotti. Le correlazioni con i reati,CREATIVITÀ,13/01/2019,"09/10/2020, 12:08:54"
https://nova.ilsole24ore.com/infodata/negli-ultimi-5-anni-il-numero-le-ore-di-sostegno-settimanali-e-aumentato-gli-insegnanti-2/,Negli ultimi 5 anni il numero le ore di sostegno settimanali è aumentato. Gli insegnanti?,CREATIVITÀ,13/01/2019,"09/10/2020, 12:08:54"
https://nova.ilsole24ore.com/infodata/negli-ultimi-5-anni-il-numero-le-ore-di-sostegno-settimanali-e-aumentato-gli-insegnanti/,Negli ultimi 5 anni il numero le ore di sostegno settimanali è aumentato. Gli insegnanti?,CREATIVITÀ,13/01/2019,"09/10/2020, 12:08:55"
https://nova.ilsole24ore.com/infodata/turismo-per-il-tutto-esaurito-in-albergo-serve-il-sito-internet/,"Turismo: per il ""tutto esaurito"" in albergo serve il sito internet?",CREATIVITÀ,12/01/2019,"09/10/2020, 12:08:55"
https://nova.ilsole24ore.com/infodata/matematica-i-numeri-primi-nellepoca-dei-big-data/,"Matematica, i numeri primi nell'epoca dei Big data",CREATIVITÀ,12/01/2019,"09/10/2020, 12:08:55"
https://nova.ilsole24ore.com/infodata/lotteria-italia-quali-sono-le-province-dove-si-vince-di-piu/,"Lotteria Italia, quali sono le province dove si vince di più?",CREATIVITÀ,12/01/2019,"09/10/2020, 12:08:56"
https://nova.ilsole24ore.com/infodata/volete-piu-sicurezza-assumete-poliziotti-le-correlazioni-e-i-reati/,Volete più sicurezza? Assumete poliziotti. Le correlazioni e i reati,CREATIVITÀ,09/01/2019,"09/10/2020, 12:08:56"
https://nova.ilsole24ore.com/infodata/crisi-del-cinema-trionfano-serie-tv-e-streaming-cosa-e-accaduto-negli-ultimi-60-anni/,"Crisi del cinema, trionfano serie tv e streaming? Cosa è accaduto negli ultimi 60 anni",CREATIVITÀ,08/01/2019,"09/10/2020, 12:08:57"
https://nova.ilsole24ore.com/infodata/oggi-tre-abitanti-della-terra-su-10-sono-cristiani-la-geografia-religiosa-nel-2050/,Oggi tre abitanti della Terra su 10 sono cristiani. La geografia religiosa nel 2050,CREATIVITÀ,08/01/2019,"09/10/2020, 12:08:57"
https://nova.ilsole24ore.com/infodata/lotteria-italia-e-frosinone-la-provincia-piu-fortunata-negli-ultimi-cinque-anni/,"Lotteria Italia, è Frosinone la provincia più fortunata (negli ultimi cinque anni)",CREATIVITÀ,07/01/2019,"09/10/2020, 12:08:57"
https://nova.ilsole24ore.com/infodata/matematica-il-mistero-dei-numeri-primi-nellepoca-dei-big-data/,"Matematica, il mistero dei numeri primi nell'epoca dei Big data",CREATIVITÀ,07/01/2019,"09/10/2020, 12:08:58"
https://nova.ilsole24ore.com/infodata/parti-cesarei-diminuiti-in-ventanni-solo-in-piemonte-e-basilica-cosa-vuole-dire-2/,Parti cesarei diminuiti in vent'anni solo in Piemonte e Basilica. Cosa vuole dire?,CREATIVITÀ,06/01/2019,"09/10/2020, 12:08:58"
https://nova.ilsole24ore.com/infodata/ventanni-senza-de-andre-dio-amore-e-tutte-le-parole-del-poeta/,"Vent'anni senza De André: Dio, Amore e tutte le parole del poeta",CREATIVITÀ,11/01/2019,"09/10/2020, 12:08:58"
https://nova.ilsole24ore.com/infodata/europa-due-secoli-di-guerre-e-conquiste-in-dieci-minuti/,Europa: due secoli di guerre e conquiste in dieci minuti,CREATIVITÀ,11/01/2019,"09/10/2020, 12:08:59"
https://nova.ilsole24ore.com/infodata/per-il-tutto-esaurito-in-albergo-serve-il-sito-internet-i-dati-e-le-correlazioni/,"Per il ""tutto esaurito"" in albergo serve il sito internet? I dati e le correlazioni",CREATIVITÀ,11/01/2019,"09/10/2020, 12:08:59"
https://nova.ilsole24ore.com/infodata/scuola-perche-parlare-di-inclusione-se-mancano-gli-insegnanti-di-sostegno/,"Scuola, perché parlare di inclusione se mancano gli insegnanti di sostegno?",CREATIVITÀ,10/01/2019,"09/10/2020, 12:09:00"
https://nova.ilsole24ore.com/infodata/come-si-misura-linnovazione-il-primato-di-israele-spiegato-con-i-numeri/,Come si misura l'innovazione? Il primato di Israele spiegato con i numeri,CREATIVITÀ,10/01/2019,"09/10/2020, 12:09:00"
https://nova.ilsole24ore.com/infodata/climate-change-2018-mai-un-anno-cosi-caldo-dai-tempi-di-napoleone/,"Climate change, 2018: mai un anno così caldo dai tempi di Napoleone",CREATIVITÀ,09/01/2019,"09/10/2020, 12:09:00"
https://nova.ilsole24ore.com/infodata/laurea-per-i-ricchi-e-apprendistato-per-i-poveri-il-caso-del-sistema-britannico/,Laurea per i ricchi e apprendistato per i poveri. Il caso del sistema britannico,CREATIVITÀ,04/01/2019,"09/10/2020, 12:09:01"
https://nova.ilsole24ore.com/infodata/chimica-trecento-anni-di-storia-degli-elementi-in-99-secondi/,Chimica: trecento anni di storia degli elementi in 99 secondi,CREATIVITÀ,03/01/2019,"09/10/2020, 12:09:01"
https://nova.ilsole24ore.com/infodata/di-chi-si-fidano-gli-italiani-del-governo-o-delleuropa-parola-alle-regioni/,Di chi si fidano gli italiani: del Governo o dell'Europa? Parola alle regioni,CREATIVITÀ,03/01/2019,"09/10/2020, 12:09:01"
https://nova.ilsole24ore.com/infodata/parti-cesarei-diminuiti-in-ventanni-solo-in-piemonte-e-basilica-cosa-vuole-dire/,Parti cesarei diminuiti in vent'anni solo in Piemonte e Basilica. Cosa vuole dire?,CREATIVITÀ,02/01/2019,"09/10/2020, 12:09:02"
https://nova.ilsole24ore.com/infodata/come-siamo-cambiati-in-italia-continuano-a-crescere-i-crimini-dodio/,Come siamo cambiati? In Italia continuano a crescere i crimini d'odio,CREATIVITÀ,02/01/2019,"09/10/2020, 12:09:02"
https://nova.ilsole24ore.com/infodata/musica-serie-tv-e-i-big-data-che-prevedono-il-successo-degli-artisti/,"Musica, serie tv e i big data che prevedono il successo degli artisti",CREATIVITÀ,01/01/2019,"09/10/2020, 12:09:03"
https://nova.ilsole24ore.com/infodata/laurea-per-i-ricchi-e-apprendistato-per-i-poveri-la-disuguaglianza-nellistruzione/,Laurea per i ricchi e apprendistato per i poveri. La disuguaglianza nell'istruzione,CREATIVITÀ,06/01/2019,"09/10/2020, 12:09:03"
https://nova.ilsole24ore.com/infodata/di-chi-si-fidano-gli-italiani-del-governo-o-delleuropa/,Di chi si fidano gli italiani: del Governo o dell'Europa?,CREATIVITÀ,06/01/2019,"09/10/2020, 12:09:03"
https://nova.ilsole24ore.com/infodata/come-siamo-cambiati-continuano-a-crescere-i-crimini-dodio-contro-gli-stranieri/,Come siamo cambiati? Continuano a crescere i crimini d'odio (contro gli stranieri),CREATIVITÀ,05/01/2019,"09/10/2020, 12:09:04"
https://nova.ilsole24ore.com/infodata/medici-asl-e-ospedali-perche-la-sanita-italiana-deve-imparare-a-usare-i-social/,"Medici, Asl e ospedali: perché la sanità italiana deve imparare a usare i social",CREATIVITÀ,05/01/2019,"09/10/2020, 12:09:04"
https://nova.ilsole24ore.com/infodata/sovranista-o-globalizzato-quanto-conta-la-nazionalita-dellinfluencer/,"Sovranista o globalizzato, quanto conta la nazionalità dell'influencer?",CREATIVITÀ,05/01/2019,"09/10/2020, 12:09:04"
https://nova.ilsole24ore.com/infodata/cosa-pensano-gli-italiani-come-siamo-cambiati-in-tre-anni-secondo-eurobarometro/,Cosa pensano gli italiani? Come siamo cambiati in tre anni secondo Eurobarometro,CREATIVITÀ,04/01/2019,"09/10/2020, 12:09:05"
https://nova.ilsole24ore.com/infodata/2018-musica-serie-tv-e-i-big-data-che-prevedono-il-successo-degli-artisti/,"2018: musica, serie tv e i big data che prevedono il successo degli artisti",CREATIVITÀ,30/12/2018,"09/10/2020, 12:09:05"
https://nova.ilsole24ore.com/infodata/elezioni-europee-cosa-accadra-un-anno-di-sondaggi/,Elezioni europee cosa accadrà? Un anno di sondaggi,CREATIVITÀ,30/12/2018,"09/10/2020, 12:09:05"
https://nova.ilsole24ore.com/infodata/riscaldamento-globale-e-sostenibilita-la-pagella-ambientale/,Riscaldamento globale e sostenibilità. La pagella ambientale,CREATIVITÀ,29/12/2018,"09/10/2020, 12:09:06"
https://nova.ilsole24ore.com/infodata/scopri-che-probabilita-ha-il-tuo-comune-di-svegliarsi-con-la-neve/,Scopri che probabilità ha il tuo Comune di svegliarsi con la neve,CREATIVITÀ,29/12/2018,"09/10/2020, 12:09:06"
https://nova.ilsole24ore.com/infodata/ecco-perche-babbo-natale-e-un-rider-della-on-demand-economy/,Ecco perché Babbo Natale è un rider della on demand economy,CREATIVITÀ,29/12/2018,"09/10/2020, 12:09:07"
https://nova.ilsole24ore.com/infodata/canta-con-noi-sei-canzoni-delle-feste-natalizie-data-driven/,Canta con noi sei canzoni delle feste natalizie (data driven),CREATIVITÀ,29/12/2018,"09/10/2020, 12:09:07"
https://nova.ilsole24ore.com/infodata/medici-als-e-ospedali-la-sanita-italiana-non-sa-usare-i-social/,"Medici, Als e ospedali: la sanità italiana non sa usare i social",CREATIVITÀ,01/01/2019,"09/10/2020, 12:09:07"
https://nova.ilsole24ore.com/infodata/2019-chi-entra-per-primo-nel-nuovo-anno-e-chi-per-ultimo/,2019: chi entra per primo nel nuovo anno? E chi per ultimo?,CREATIVITÀ,31/12/2018,"09/10/2020, 12:09:08"
https://nova.ilsole24ore.com/infodata/la-globalizzazione-dello-youtuber-quanto-conta-la-nazionalita/,La globalizzazione dello YouTuber. Quanto conta la nazionalità?,CREATIVITÀ,31/12/2018,"09/10/2020, 12:09:08"
https://nova.ilsole24ore.com/infodata/2018-inquinamento-alluvioni-e-meteo-lanno-dei-disastri/,"2018: inquinamento, alluvioni e meteo. L'anno dei disastri",CREATIVITÀ,30/12/2018,"09/10/2020, 12:09:08"
https://nova.ilsole24ore.com/infodata/il-2018-e-la-criminalita-la-percezione-della-sicurezza-e-i-dati-di-realta/,Il 2018 e la criminalità: la percezione della sicurezza e i dati di realtà,CREATIVITÀ,30/12/2018,"09/10/2020, 12:09:09"
https://nova.ilsole24ore.com/infodata/lemergenza-migranti-e-quattro-luoghi-comuni-da-sfatare/,L'emergenza migranti e quattro luoghi comuni da sfatare,CREATIVITÀ,30/12/2018,"09/10/2020, 12:09:09"
https://nova.ilsole24ore.com/infodata/2018-inquinamento-alluvioni-e-meteo-lanno-maledetto/,"2018: inquinamento, alluvioni e meteo. L'anno maledetto",CREATIVITÀ,28/12/2018,"09/10/2020, 12:09:09"
https://nova.ilsole24ore.com/infodata/2018-omicidi-furti-e-rapine-la-percezione-della-sicurezza-e-i-dati-di-realta/,"2018: omicidi, furti e rapine. La percezione della sicurezza e i dati di realtà",CREATIVITÀ,28/12/2018,"09/10/2020, 12:09:10"
https://nova.ilsole24ore.com/infodata/quanto-vale-il-non-profit-litalia-divisa-in-due/,Quanto vale il non profit? L'Italia divisa in due,CREATIVITÀ,27/12/2018,"09/10/2020, 12:09:10"
https://nova.ilsole24ore.com/infodata/2018-come-e-cambiata-litalia-dallimmigrazione-alla-politica-la-nuova-identita/,2018: come è cambiata l'Italia? Dall'immigrazione alla politica la nuova identità,CREATIVITÀ,27/12/2018,"09/10/2020, 12:09:11"
https://nova.ilsole24ore.com/infodata/2018-lemergenza-migranti-e-quattro-luoghi-comuni-da-sfatare/,2018: l'emergenza migranti e quattro luoghi comuni da sfatare,CREATIVITÀ,27/12/2018,"09/10/2020, 12:09:11"
https://nova.ilsole24ore.com/infodata/elezioni-europee-2019-i-dati-di-un-anno-di-sondaggi/,Elezioni europee 2019: i dati di un anno di sondaggi,CREATIVITÀ,26/12/2018,"09/10/2020, 12:09:11"
https://nova.ilsole24ore.com/infodata/il-2018-il-riscaldamento-globale-e-la-sostenibilita-la-pagella-ambientale-italiana/,"Il 2018, il riscaldamento globale e la sostenibilità. La pagella ambientale italiana",CREATIVITÀ,26/12/2018,"09/10/2020, 12:09:12"
https://nova.ilsole24ore.com/infodata/natale-scopri-che-probabilita-ha-il-tuo-comune-di-svegliarsi-con-la-neve/,"Natale, scopri che probabilità ha il tuo Comune di svegliarsi con la neve",CREATIVITÀ,25/12/2018,"09/10/2020, 12:09:12"
https://nova.ilsole24ore.com/infodata/canta-con-noi-sei-canzoni-di-natale-data-driven/,Canta con noi sei canzoni di Natale (data driven),CREATIVITÀ,24/12/2018,"09/10/2020, 12:09:12"
https://nova.ilsole24ore.com/infodata/il-viaggio-di-babbo-natale-una-notte-per-consegnare-590-milioni-di-regali/,Il viaggio di Babbo Natale: una notte per consegnare 590 milioni di regali,CREATIVITÀ,24/12/2018,"09/10/2020, 12:09:13"
https://nova.ilsole24ore.com/infodata/scopri-la-mappa-delle-citta-piu-inquinate-ditalia/,Scopri la mappa delle città più inquinate d'Italia,CREATIVITÀ,23/12/2018,"09/10/2020, 12:09:13"
https://nova.ilsole24ore.com/infodata/pm10-chi-sono-i-principali-responsabili-dellinquinamento/,Pm10: chi sono i principali responsabili dell'inquinamento?,CREATIVITÀ,23/12/2018,"09/10/2020, 12:09:14"
https://nova.ilsole24ore.com/infodata/pm10-sono-le-caldaie-le-principali-responsabili-dellinquinamento/,"Pm10, sono le caldaie le principali responsabili dell'inquinamento",CREATIVITÀ,21/12/2018,"09/10/2020, 12:09:14"
https://nova.ilsole24ore.com/infodata/elezioni-europee-2019-cosa-dicono-un-anno-di-sondaggi/,Elezioni europee 2019: cosa dicono un anno di sondaggi,CREATIVITÀ,20/12/2018,"09/10/2020, 12:09:14"
https://nova.ilsole24ore.com/infodata/retribuzioni-i-nuovi-rapporti-di-lavoro-sono-sempre-meno-pagati-la-mappa/,Retribuzioni: i nuovi rapporti di lavoro sono sempre meno pagati. La mappa,CREATIVITÀ,20/12/2018,"09/10/2020, 12:09:15"
https://nova.ilsole24ore.com/infodata/criminalita-organizzata-tutti-i-numeri-della-lotta-alla-mafia/,Criminalità organizzata: tutti i numeri della lotta alla mafia,CREATIVITÀ,20/12/2018,"09/10/2020, 12:09:15"
https://nova.ilsole24ore.com/infodata/droga-oltre-38mila-consumatori-segnalati-ai-prefetti-ecco-la-mappa/,"Droga, oltre 38mila consumatori segnalati ai prefetti. Ecco la mappa",CREATIVITÀ,19/12/2018,"09/10/2020, 12:09:15"
https://nova.ilsole24ore.com/infodata/salute-una-famiglia-a-reddito-basso-spende-in-media-25-euro-al-mese/,Salute: una famiglia a reddito basso spende in media 25 euro al mese,CREATIVITÀ,19/12/2018,"09/10/2020, 12:09:16"
https://nova.ilsole24ore.com/infodata/oltre-38mila-consumatori-segnalati-ai-prefetti-ecco-la-mappa-dei-drogati/,Oltre 38mila consumatori segnalati ai prefetti. Ecco la mappa dei drogati,CREATIVITÀ,23/12/2018,"09/10/2020, 12:09:16"
https://nova.ilsole24ore.com/infodata/differenze-di-genere-che-differenza-ce-tra-un-olandese-e-un-italiano/,Differenze di genere: che differenza c'è tra un olandese e un italiano?,CREATIVITÀ,22/12/2018,"09/10/2020, 12:09:16"
https://nova.ilsole24ore.com/infodata/calano-le-famiglie-povere-in-italia-ma-anche-il-reddito-delle-donne/,Calano le famiglie povere in Italia. Ma anche il reddito delle donne,CREATIVITÀ,22/12/2018,"09/10/2020, 12:09:17"
https://nova.ilsole24ore.com/infodata/occupazione-giovani-e-pattern-statistici-cosa-e-accaduto-in-italia/,"Occupazione, giovani e pattern statistici. Cosa è accaduto in Italia?",CREATIVITÀ,22/12/2018,"09/10/2020, 12:09:17"
https://nova.ilsole24ore.com/infodata/90-anni-di-topolino-in-130-cortometraggi/,90 anni di Topolino in 130 cortometraggi,CREATIVITÀ,22/12/2018,"09/10/2020, 12:09:18"
https://nova.ilsole24ore.com/infodata/la-mappa-delle-citta-piu-inquinate-ditalia-i-casi-di-torino-e-frosinone/,La mappa delle città più inquinate d'Italia. I casi di Torino e Frosinone,CREATIVITÀ,21/12/2018,"09/10/2020, 12:09:18"
https://nova.ilsole24ore.com/infodata/sanita-litalia-non-e-un-paese-per-vecchi/,Sanità: l'Italia non è un Paese per vecchi,CREATIVITÀ,16/12/2018,"09/10/2020, 12:09:18"
https://nova.ilsole24ore.com/infodata/in-quanti-anni-di-lavoro-si-ripaga-una-laurea/,In quanti anni di lavoro si ripaga una laurea?,CREATIVITÀ,16/12/2018,"09/10/2020, 12:09:19"
https://nova.ilsole24ore.com/infodata/agenda-digitale-dove-nascono-piu-siti-ce-piu-ricchezza/,Agenda digitale: dove nascono più siti c'è più ricchezza,CREATIVITÀ,15/12/2018,"09/10/2020, 12:09:19"
https://nova.ilsole24ore.com/infodata/crescano-i-lavoratori-extracomunitari-in-italia-ma-anche-i-sussidi/,Crescano i lavoratori extracomunitari in Italia. Ma anche i sussidi,CREATIVITÀ,15/12/2018,"09/10/2020, 12:09:19"
https://nova.ilsole24ore.com/infodata/decreto-dignita-e-lotta-al-precariato-perche-i-conti-non-tornano/,Decreto dignità e lotta al precariato: perché i conti non tornano?,CREATIVITÀ,15/12/2018,"09/10/2020, 12:09:20"
https://nova.ilsole24ore.com/infodata/morbillo-nel-mondo-ancora-oggi-208-milioni-di-bambini-non-sono-vaccinati/,"Morbillo: nel mondo ancora oggi 20,8 milioni di bambini non sono vaccinati",CREATIVITÀ,15/12/2018,"09/10/2020, 12:09:20"
https://nova.ilsole24ore.com/infodata/che-differenza-ce-tra-un-olandese-e-un-italiano-chiedetelo-alla-loro-moglie/,Che differenza c'è tra un olandese e un italiano? Chiedetelo alla loro moglie,CREATIVITÀ,18/12/2018,"09/10/2020, 12:09:21"
https://nova.ilsole24ore.com/infodata/meno-famiglie-povere-in-italia-nel-2017-ma-piu-donne-povere/,Meno famiglie povere in Italia nel 2017. Ma più donne povere.,CREATIVITÀ,18/12/2018,"09/10/2020, 12:09:21"
https://nova.ilsole24ore.com/infodata/occupazione-giovani-e-luoghi-comuni-cosa-e-accaduto-in-italia/,"Occupazione, giovani e luoghi comuni. Cosa è accaduto in Italia?",CREATIVITÀ,17/12/2018,"09/10/2020, 12:09:21"
https://nova.ilsole24ore.com/infodata/un-topolino-cosi-non-lavete-mai-visto-o-cliccato/,Un Topolino così non l'avete mai visto (o cliccato),CREATIVITÀ,17/12/2018,"09/10/2020, 12:09:22"
https://nova.ilsole24ore.com/infodata/sessantanni-di-singoli-di-successo-come-e-cambiata-oggi-la-musica/,Sessant'anni di singoli di successo. Come è cambiata oggi la musica?,CREATIVITÀ,16/12/2018,"09/10/2020, 12:09:22"
https://nova.ilsole24ore.com/infodata/emergenza-sanita-in-sei-anni-il-molise-ha-perso-il-75-di-medici/,Emergenza sanità: in sei anni il Molise ha perso il 75% di medici,CREATIVITÀ,16/12/2018,"09/10/2020, 12:09:22"
https://nova.ilsole24ore.com/infodata/sessantanni-di-singoli-di-successo-scopri-come-e-cambiata-la-musica/,Sessant'anni di singoli di successo. Scopri come è cambiata la musica,CREATIVITÀ,14/12/2018,"09/10/2020, 12:09:23"
https://nova.ilsole24ore.com/infodata/digitale-piu-siti-si-registrano-in-un-territorio-piu-sono-ricchi-i-suoi-abitanti/,"Digitale, più siti si registrano in un territorio, più sono ricchi i suoi abitanti",CREATIVITÀ,14/12/2018,"09/10/2020, 12:09:23"
https://nova.ilsole24ore.com/infodata/sempre-meno-infermieri-e-operatori-sanitari-tutti-i-dati-regione-per-regione/,Sempre meno infermieri e operatori sanitari: tutti i dati regione per regione,CREATIVITÀ,14/12/2018,"09/10/2020, 12:09:24"
https://nova.ilsole24ore.com/infodata/quanti-sono-48-zettabyte-lintero-traffico-dati-transitato-su-internet-tra-il-1984-ed-il-2016/,"Quanti sono 4,8 zettabyte? L'intero traffico dati transitato su Internet tra il 1984 ed il 2016",CREATIVITÀ,13/12/2018,"09/10/2020, 12:09:24"
https://nova.ilsole24ore.com/infodata/gli-italiani-invecchiano-ma-le-risorse-per-la-loro-cura-non-aumentano/,Gli italiani invecchiano ma le risorse per la loro cura non aumentano,CREATIVITÀ,13/12/2018,"09/10/2020, 12:09:24"
https://nova.ilsole24ore.com/infodata/in-quanti-anni-di-lavoro-si-ripaga-una-laurea-dipende-in-base-a-dove-vivi/,In quanti anni di lavoro si ripaga una laurea? Dipende in base a dove vivi,CREATIVITÀ,12/12/2018,"09/10/2020, 12:09:25"
https://nova.ilsole24ore.com/infodata/scopri-i-prodotti-dop-e-igp-in-europa-italia-sempre-campione/,Scopri i prodotti Dop e Igp in Europa. Italia sempre campione,CREATIVITÀ,11/12/2018,"09/10/2020, 12:09:25"
https://nova.ilsole24ore.com/infodata/aids-nel-2017-in-europa-25mila-contagi-da-hiv-i-numeri-dellepidemia-che-non-e-finita/,Aids: nel 2017 in Europa 25mila contagi da Hiv. I numeri dell'epidemia che non è finita,CREATIVITÀ,11/12/2018,"09/10/2020, 12:09:25"
https://nova.ilsole24ore.com/infodata/quanto-guadagnano-e-cosa-fanno-i-cittadini-extracomunitari-in-italia/,Quanto guadagnano e cosa fanno i cittadini extracomunitari in Italia?,CREATIVITÀ,11/12/2018,"09/10/2020, 12:09:26"
https://nova.ilsole24ore.com/infodata/decreto-dignita-e-lotta-al-precariato-i-conti-non-tornano/,Decreto dignità e lotta al precariato: i conti non tornano,CREATIVITÀ,10/12/2018,"09/10/2020, 12:09:26"
https://nova.ilsole24ore.com/infodata/vaccini-211-milioni-di-morti-per-morbillo-evitate-dal-2000/,"Vaccini: 21,1 milioni di morti per morbillo evitate dal 2000",CREATIVITÀ,10/12/2018,"09/10/2020, 12:09:27"
https://nova.ilsole24ore.com/infodata/quanto-spenderemo-per-le-feste-i-conti-in-tasca-a-babbo-natale/,Quanto spenderemo per le feste? I conti in tasca a Babbo Natale,CREATIVITÀ,09/12/2018,"09/10/2020, 12:09:27"
https://nova.ilsole24ore.com/infodata/non-ce-solo-game-of-thrones-esiste-una-coda-lunga-delle-serie-tv/,Non c'è solo Game of Thrones: esiste una coda lunga delle serie tv,CREATIVITÀ,09/12/2018,"09/10/2020, 12:09:27"
https://nova.ilsole24ore.com/infodata/e-meglio-uno-stato-democratico-o-uno-non-democratico/,E' meglio uno stato democratico o uno non democratico?,CREATIVITÀ,09/12/2018,"09/10/2020, 12:09:28"
https://nova.ilsole24ore.com/infodata/agenda-digitale-tra-gli-italiani-e-internet-non-e-mai-stato-vero-amore/,Agenda digitale: tra gli italiani e internet non è mai stato vero amore,CREATIVITÀ,08/12/2018,"09/10/2020, 12:09:28"
https://nova.ilsole24ore.com/infodata/la-spesa-sanitaria-pubblica-e-privata-e-l89-del-pil/,"La spesa sanitaria pubblica e privata è l'8,9% del Pil",CREATIVITÀ,08/12/2018,"09/10/2020, 12:09:28"
https://nova.ilsole24ore.com/infodata/i-sessantenni-sono-la-generazione-piu-ricca-e-la-piu-povera/,I sessantenni sono la generazione più ricca. E la più povera?,CREATIVITÀ,08/12/2018,"09/10/2020, 12:09:29"
https://nova.ilsole24ore.com/infodata/quali-sono-le-province-italiano-da-cui-i-giovani-fuggono-via/,Quali sono le province italiano da cui i giovani fuggono via?,CREATIVITÀ,08/12/2018,"09/10/2020, 12:09:29"
https://nova.ilsole24ore.com/infodata/il-gender-gap-delle-retribuzioni-chi-dedica-piu-tempo-al-lavoro-pagato/,Il gender gap delle retribuzioni: chi dedica più tempo al lavoro pagato?,CREATIVITÀ,07/12/2018,"09/10/2020, 12:09:30"
https://nova.ilsole24ore.com/infodata/addobbi-di-natale-e-calendari-negli-usa-i-supermercati-battono-lecommerce/,Addobbi di Natale e calendari: negli Usa i supermercati battono l'ecommerce,CREATIVITÀ,07/12/2018,"09/10/2020, 12:09:30"
https://nova.ilsole24ore.com/infodata/lislam-il-cristianesimo-e-lo-sciovinismo-le-democrazie-deuropa/,"L'Islam, il cristianesimo e lo sciovinismo: le ""democrazie"" d'Europa",CREATIVITÀ,06/12/2018,"09/10/2020, 12:09:30"
https://nova.ilsole24ore.com/infodata/le-donne-italiane-svolgono-lavoro-non-pagato-per-cinque-ore-al-giorno/,Le donne italiane svolgono lavoro non pagato per cinque ore al giorno.,CREATIVITÀ,06/12/2018,"09/10/2020, 12:09:31"
https://nova.ilsole24ore.com/infodata/spesa-sanitaria-vs-spesa-sanitaria-pubblica-la-guerra-dei-numeri-della-salute/,Spesa sanitaria vs spesa sanitaria pubblica. La guerra dei numeri della salute,CREATIVITÀ,05/12/2018,"09/10/2020, 12:09:31"
https://nova.ilsole24ore.com/infodata/i-sessantenni-di-oggi-sono-la-generazione-piu-ricca-i-piu-poveri-i-post-1986/,I sessantenni di oggi sono la generazione più ricca. I più poveri i post-1986,CREATIVITÀ,05/12/2018,"09/10/2020, 12:09:31"
https://nova.ilsole24ore.com/infodata/demografia-la-fine-delle-famiglie-numerose-in-italia/,Demografia: la fine delle famiglie numerose (in Italia),CREATIVITÀ,02/12/2018,"09/10/2020, 12:09:32"
https://nova.ilsole24ore.com/infodata/perche-la-smart-tv-in-europa-e-ancora-un-ufo/,Perché la smart tv in Europa è ancora un Ufo?,CREATIVITÀ,02/12/2018,"09/10/2020, 12:09:32"
https://nova.ilsole24ore.com/infodata/gli-scacchi-nellera-degli-algoritmi-magnus-carlsen-e-campione-del-mondo/,Gli scacchi nell'era degli algoritmi. Magnus Carlsen è campione del mondo,CREATIVITÀ,02/12/2018,"09/10/2020, 12:09:33"
